{
 "acquisition": {
  "counters": {
   "chat_template_renders": 8,
   "decode_calls": 0,
   "encode_calls": 32,
   "evidence_ledger_rows_written": 0,
   "execution_seeds_drawn": 0,
   "files_acquired": 16,
   "forward_passes": 0,
   "generations": 0,
   "gpu_or_cloud_jobs": 0,
   "interfaces_selected": 0,
   "logit_reads": 0,
   "model_constructions": 0,
   "network_file_downloads": 16,
   "network_metadata_requests": 4,
   "prefill_operations": 0,
   "remote_code_executions": 0,
   "scientific_items_realized": 0,
   "scoring_operations": 0,
   "tokenizer_constructions": 4,
   "weight_files_acquired": 0
  },
  "download_allow_list": [
   "config.json",
   "generation_config.json",
   "tokenizer_config.json",
   "tokenizer.json"
  ],
  "library_versions": {
   "huggingface_hub": "1.17.0",
   "python": "3.13.15",
   "tokenizers": "0.22.2",
   "transformers": "5.13.0"
  },
  "network_request_count": 20,
  "no_weight_file_proof": {
   "every_acquired_path_is_in_the_allow_list": true,
   "no_acquired_path_has_a_weight_suffix": true,
   "weight_bytes_acquired_total": 0,
   "weight_files_acquired_total": 0,
   "weight_paths_requested_total": 0,
   "weight_suffixes_treated_as_weight_bearing": [
    ".safetensors",
    ".bin",
    ".pt",
    ".pth",
    ".ckpt",
    ".h5",
    ".msgpack",
    ".gguf",
    ".onnx",
    ".npz",
    ".pkl"
   ]
  },
  "observation_timestamp_utc": "2026-08-16T08:45:03Z",
  "trust_remote_code": false
 },
 "authority": "studies/study3r/prompts/study3r_protocol_v1_authoring_authority.md",
 "authority_identity": {
  "bytes": 16972,
  "commit": "5a80c673062583f8a1c3459662a54deca4939232",
  "git_blob": "6d5c2b2657185d3088e10f03fa7713881b2b9c57",
  "lf_only": true,
  "parent_commit": "cd9c0af3118ca2f254bd0bbaa8eb2ee4dad6d1ed",
  "path": "studies/study3r/prompts/study3r_protocol_v1_authoring_authority.md",
  "published_alone_as_the_first_commit_after_the_starting_state": true,
  "published_before_any_other_artifact": true,
  "sha256": "bafd90a73261dc710b861a1f9bcf286804b3e902bc31b8342e39174b9bfe0200"
 },
 "boundary": {
  "banks_realized": 0,
  "evidence_ledger_last_row": "EV-0016",
  "evidence_ledger_rows_written": 0,
  "execution_authorized": false,
  "formal_execution_authorized": false,
  "protocol_frozen": false,
  "rp_b_candidates_selected": 0,
  "scientific_claims_made": 0,
  "seeds_drawn": 0,
  "study3m_artifacts": [],
  "tokenizer_only_counters": {
   "chat_template_renders": 8,
   "encode_calls": 32,
   "files_acquired": 16,
   "network_file_downloads": 16,
   "network_metadata_requests": 4,
   "tokenizer_constructions": 4
  },
  "zero_operation_counters": {
   "decode_calls": 0,
   "evidence_ledger_rows_written": 0,
   "execution_seeds_drawn": 0,
   "forward_passes": 0,
   "generations": 0,
   "gpu_or_cloud_jobs": 0,
   "interfaces_selected": 0,
   "logit_reads": 0,
   "model_constructions": 0,
   "prefill_operations": 0,
   "remote_code_executions": 0,
   "scientific_items_realized": 0,
   "scoring_operations": 0,
   "weight_files_acquired": 0
  }
 },
 "census": {
  "atomic_cell_count": 58,
  "counts_by_gate": {
   "G01_COT_CEILING": 4,
   "G02_CONTROL_RECOVERY": 8,
   "G03_CONTROL_BINDING": 8,
   "G04_CONTROL_PRIMITIVE": 8,
   "G05_NEGATIVE_CONTROL": 8,
   "G06_WRAPPER_JOINT_ADEQUACY": 8,
   "G07_RPB_DEVELOPMENT": 6,
   "G08_RPB_CONFIRMATION": 6,
   "G09_RT_E0_QUALIFICATION": 2
  },
  "m_max": 58,
  "scheduled_item_evaluations": 8108
 },
 "checkpoints": [
  {
   "acquired_file_sha256": {
    "config.json": "37bd455e9679d2959536270fed49d25cc7c290a64f6e52abb97c71345a9cee41",
    "generation_config.json": "72cbec1015da9ed03ad025483005cbf6481403abf947adfd54e504d1a66a2126",
    "tokenizer.json": "88145e3c3249adc2546ede277e9819d6e405e19072456e4b521cbc724bd60773",
    "tokenizer_config.json": "8ac8c85fb242563c2260baec0909debd69d718af6a0b3d90e6cab62b4d341cd5"
   },
   "chat_template_sha256": "56a1447ad31926fdc21fb07e56e5642bd9c850c4f52d8c8af7bbe5f079a84f5f",
   "context_window": 131072,
   "e0_max_new_tokens": 2,
   "immutable_revision": "ad9f0ae0864d7fbcd1cd905e3c6c5b069cc8b562",
   "repository_id": "deepseek-ai/DeepSeek-R1-Distill-Qwen-1.5B",
   "role": "RT",
   "tokenizer_class": "Qwen2Tokenizer",
   "vocab_size": 151643
  },
  {
   "acquired_file_sha256": {
    "config.json": "8290d3c1e385e2616572eb6926f7e2745f901d1c13da95970326a8a73f6c379c",
    "generation_config.json": "72cbec1015da9ed03ad025483005cbf6481403abf947adfd54e504d1a66a2126",
    "tokenizer.json": "88145e3c3249adc2546ede277e9819d6e405e19072456e4b521cbc724bd60773",
    "tokenizer_config.json": "8ac8c85fb242563c2260baec0909debd69d718af6a0b3d90e6cab62b4d341cd5"
   },
   "chat_template_sha256": "56a1447ad31926fdc21fb07e56e5642bd9c850c4f52d8c8af7bbe5f079a84f5f",
   "context_window": 131072,
   "e0_max_new_tokens": 2,
   "immutable_revision": "916b56a44061fd5cd7d6a8fb632557ed4f724f60",
   "repository_id": "deepseek-ai/DeepSeek-R1-Distill-Qwen-7B",
   "role": "RP_B1",
   "tokenizer_class": "Qwen2Tokenizer",
   "vocab_size": 151643
  },
  {
   "acquired_file_sha256": {
    "config.json": "fdb89460be9a6383451437cdf632a3e087522efa682265461f33507e7069f026",
    "generation_config.json": "72cbec1015da9ed03ad025483005cbf6481403abf947adfd54e504d1a66a2126",
    "tokenizer.json": "88145e3c3249adc2546ede277e9819d6e405e19072456e4b521cbc724bd60773",
    "tokenizer_config.json": "8ac8c85fb242563c2260baec0909debd69d718af6a0b3d90e6cab62b4d341cd5"
   },
   "chat_template_sha256": "56a1447ad31926fdc21fb07e56e5642bd9c850c4f52d8c8af7bbe5f079a84f5f",
   "context_window": 131072,
   "e0_max_new_tokens": 2,
   "immutable_revision": "1df8507178afcc1bef68cd8c393f61a886323761",
   "repository_id": "deepseek-ai/DeepSeek-R1-Distill-Qwen-14B",
   "role": "RP_B2",
   "tokenizer_class": "Qwen2Tokenizer",
   "vocab_size": 151643
  },
  {
   "acquired_file_sha256": {
    "config.json": "2c003fe40b13d2d1f372254d77177ed753176150f3d424d1b5ad22ff1d78a987",
    "generation_config.json": "72cbec1015da9ed03ad025483005cbf6481403abf947adfd54e504d1a66a2126",
    "tokenizer.json": "88145e3c3249adc2546ede277e9819d6e405e19072456e4b521cbc724bd60773",
    "tokenizer_config.json": "8ac8c85fb242563c2260baec0909debd69d718af6a0b3d90e6cab62b4d341cd5"
   },
   "chat_template_sha256": "56a1447ad31926fdc21fb07e56e5642bd9c850c4f52d8c8af7bbe5f079a84f5f",
   "context_window": 131072,
   "e0_max_new_tokens": 2,
   "immutable_revision": "711ad2ea6aa40cfca18895e8aca02ab92df1a746",
   "repository_id": "deepseek-ai/DeepSeek-R1-Distill-Qwen-32B",
   "role": "RP_B3",
   "tokenizer_class": "Qwen2Tokenizer",
   "vocab_size": 151643
  }
 ],
 "estimands": {
  "diagnostic": "D0_single_forward_decodability",
  "diagnostic_limitation": "D0_single_forward_decodability proves only conditional discriminant decodability at a frozen position under a frozen counterfactual surface. It never demonstrates natural expression, never demonstrates complete-answer competence, is never an RP-B gate and never qualifies a candidate.",
  "generated_cot_ceiling": "COT_generated_reasoning_ceiling",
  "generated_cot_k": 1,
  "generated_cot_limitation": "A generated-CoT ceiling pass proves only that the checkpoint has generated-CoT headroom on the registered ceiling bank. Neither a pass nor a failure selects an interface, selects a wrapper arm, or demonstrates no-CoT capability.",
  "primary": "E0_zero_generated_reasoning_token_expressed_competence",
  "primary_max_new_tokens_rule": "per checkpoint revision: the longest frozen legal answer surface in tokens plus the registered termination margin",
  "primary_scoring": {
   "empty_output": "incorrect",
   "prefix_matching_permitted": false,
   "rationale_or_extra_emitted_token_permitted": false,
   "rule": "full_sequence_exact_match",
   "runtime_failure": "incorrect",
   "trailing_eos_tokens_stripped_before_comparison": 1,
   "unparseable_output": "incorrect"
  }
 },
 "final_origin_main": {
  "before_the_disclosure_commit": "a6ea96f80db38eddefcbbbc4e58c53f305e3c702",
  "reason": "The final origin/main is the commit that publishes this disclosure, so its identity cannot be embedded in the disclosure itself without a hash fixed point. It is the head of the linear ancestry recorded above plus exactly one further commit carrying this disclosure and the Study 3R routing update, and it is verifiable directly from the published branch.",
  "recorded_in_this_document": null
 },
 "force_pushes": 0,
 "gates": [
  {
   "alpha_global": "1/20",
   "alpha_per_cell": "1/1160",
   "atomic_cell_count": 4,
   "chance_level": "1/4",
   "confirmation_alpha": "1/1160",
   "development_alpha": "1/1160",
   "direction": "greater_than_floor",
   "effect_or_adequacy_margin": "9/10",
   "exact_power": "3649994395511386045662950343266438314941294991100214716358181957251678990356249827186560912045348197252159489752942195288002513/4000000000000000000000000000000000000000000000000000000000000000000000000000000000000000000000000000000000000000000000000000000",
   "exact_size": "99171381114898181924170235025500042403684356486489326500278890009840169577/115792089237316195423570985008687907853269984665640564039457584007913129639936",
   "floor_or_upper_margin": "3/4",
   "gate_id": "G01_COT_CEILING",
   "n": 128,
   "pass_boundary": 111,
   "power_target": "9/10",
   "terminal_on_failure": "T03_COT_CEILING_FAILED"
  },
  {
   "alpha_global": "1/20",
   "alpha_per_cell": "1/1160",
   "atomic_cell_count": 8,
   "chance_level": "1/4",
   "confirmation_alpha": "1/1160",
   "development_alpha": "1/1160",
   "direction": "greater_than_floor",
   "effect_or_adequacy_margin": "99/100",